{
  "artifact_paths": {
    "audit_log": "audit.log",
    "findings": "findings.json",
    "junit": "junit.xml",
    "report_html": "report.html",
    "report_md": "report.md",
    "sarif": "sarif.json",
    "score": "score.json"
  },
  "config_digest": "sha256:19f52782733b58974ca2227cf6a9fd922cc8770774fe4b13edff166a60e1d331",
  "errors": [],
  "finished_at": "2026-05-27T12:00:30+00:00",
  "modules_run": [
    "accessibility",
    "functional"
  ],
  "quality_score": 87.25,
  "release_decision": "pass",
  "run_id": "RUN-PASSEDAAAAAA",
  "schema_version": "1",
  "started_at": "2026-05-27T12:00:00+00:00",
  "status": "passed",
  "summary": {
    "blocked": 0,
    "failed": 0,
    "info": 1,
    "passed": 2
  },
  "target": {
    "base_url": "https://localhost:8080/",
    "host": "localhost",
    "mode": "safe"
  }
}
